[
  {
    "contract": "extension-manifest",
    "version": "1.0.0",
    "extension_id": "bizcity.zalo-bot",
    "extension_version": "1.0.0",
    "requires_framework": ">=1.3 <2.0",
    "capabilities": ["channel.inbound", "channel.outbound", "context.admit"],
    "channels": [
      {
        "slug": "zalo_bot",
        "platform": "ZALO_BOT",
        "zone": "admin",
        "identity_policy": "bot_user_or_group",
        "account_scope": "multiple",
        "crm_policy": "enabled",
        "brain_policy": "user_bound",
        "context_policy": "conversation_summary",
        "surface_policy": ["admin", "gpt_member"]
      }
    ],
    "diagnostics": {
      "probe_owner": "core.channel.zalo_bot.contract",
      "requires": ["disk", "loader", "runtime"]
    }
  },
  {
    "contract": "extension-manifest",
    "version": "1.0.0",
    "extension_id": "bizcity.zalo-oa",
    "extension_version": "1.0.0",
    "requires_framework": ">=1.3 <2.0",
    "capabilities": ["channel.inbound", "channel.outbound", "context.admit"],
    "channels": [
      {
        "slug": "zalo_oa",
        "platform": "ZALO_OA",
        "zone": "customer",
        "identity_policy": "oa_account_customer",
        "account_scope": "multiple",
        "crm_policy": "enabled",
        "brain_policy": "guest_channel",
        "context_policy": "conversation_summary",
        "surface_policy": ["admin", "gpt_member"]
      }
    ],
    "diagnostics": {
      "probe_owner": "core.channel.zalo_oa.contract",
      "requires": ["disk", "loader", "runtime"]
    }
  },
  {
    "contract": "extension-manifest",
    "version": "1.0.0",
    "extension_id": "bizcity.zalo-personal",
    "extension_version": "1.0.0",
    "requires_framework": ">=1.3 <2.0",
    "capabilities": ["channel.inbound", "channel.outbound", "context.admit"],
    "channels": [
      {
        "slug": "zalo_personal",
        "platform": "ZALO_PERSONAL",
        "zone": "customer",
        "identity_policy": "personal_account_peer",
        "account_scope": "multiple",
        "crm_policy": "enabled",
        "brain_policy": "guest_channel",
        "context_policy": "conversation_summary",
        "surface_policy": ["admin", "gpt_member"]
      }
    ],
    "diagnostics": {
      "probe_owner": "core.channel.zalo_personal.contract",
      "requires": ["disk", "loader", "runtime"]
    }
  },
  {
    "contract": "extension-manifest",
    "version": "1.0.0",
    "extension_id": "bizcity.facebook-messenger",
    "extension_version": "1.0.0",
    "requires_framework": ">=1.3 <2.0",
    "capabilities": ["channel.inbound", "channel.outbound", "context.admit"],
    "channels": [
      {
        "slug": "facebook",
        "platform": "FACEBOOK",
        "zone": "customer",
        "identity_policy": "page_account_psid",
        "account_scope": "multiple",
        "crm_policy": "enabled",
        "brain_policy": "guest_channel",
        "context_policy": "conversation_summary",
        "surface_policy": ["admin", "gpt_member"]
      }
    ],
    "diagnostics": {
      "probe_owner": "core.channel.facebook_messenger.contract",
      "requires": ["disk", "loader", "runtime"]
    }
  },
  {
    "contract": "extension-manifest",
    "version": "1.0.0",
    "extension_id": "bizcity.mabel-wheel",
    "extension_version": "1.0.0",
    "requires_framework": ">=1.3 <2.0",
    "capabilities": ["channel.inbound", "context.admit"],
    "channels": [
      {
        "slug": "mabel_wheel",
        "platform": "MABEL_WHEEL",
        "zone": "customer",
        "identity_policy": "passive_contact_identity",
        "account_scope": "multiple",
        "crm_policy": "enabled",
        "brain_policy": "guest_channel",
        "context_policy": "conversation_summary",
        "surface_policy": ["admin", "gpt_member"]
      }
    ],
    "diagnostics": {
      "probe_owner": "core.channel.mabel_wheel_bridge",
      "requires": ["disk", "loader", "runtime"]
    }
  }
]
